Kiley,67,"University of Massachusetts, Amherst",Q15142,"32,045 (Fall 2021)","24,231 (Fall 2021)","7,814 (Fall 2021)",R1,"42.388888888889,-72.527777777778",Amherst,MA,,https://www.umass.edu/,https://www.umass.edu/ctl/how-do-i-consider-impact-ai-tools-chatgpt-my-courses,"How Do I Consider the Impact of AI Tools like ChatGPT in My Courses? 

Students may be interested in using artificial Intelligence (AI) tools like ChatGPT (an AI tool that can immediately craft text in response to users’ prompts) to enhance their own writing. Conversely, faculty may be apprehensive of students’ AI use in demonstrations of their learning, such as through writing research papers, creating code and scripts, or solving problem sets. However, some instructors may even be interested in using AI tools in their courses to create novel learning experiences. As you navigate where you might fall on this continuum, we encourage you to review the following strategies and examples when considering AI use in your courses. 

STRATEGIES & EXAMPLES
Examine Privacy and Data Collection Practices. Before encouraging or asking students to use AI tools in their work, investigate how these tools collect personal information and data, including reading any privacy policy linked with a particular AI tool. Some tools may use log-in data, tracking, and other analytics (Center for New Designs in Learning and Scholarship, 2023). This same advice applies to you, as a faculty member. Should you want to input your existing writing prompts into an AI tool to see the output, consider your own data privacy. Instructors who may want to make use of ChatGPT or other technology tools in their classes should note that, as with any online service that is not contracted by the university, in view of FERPA regulations, students must not be required to identify themselves to third parties.
Write a syllabus statement that clarifies the expectations of AI use. The Faculty Senate Rules Committee has made a determination that, absent any guidance from the instructor, the use of ChatCPT and similar AI text generators is prohibited according to the Academic Honesty Policy. Instructors do have the discretion to allow for the use of such tools, however, and must do so explicitly if they want to allow it. Stating what you expect students to use (or not use) in their work helps to answer any questions around what extra support is permittable. Depending on your pedagogical values and course expectations, consider adopting or revising one of the statements below for your syllabus. (All statements adapted from Artificial Intelligence Tools and Teaching by Iowa University’s Office of Teaching, Learning, & Technology.) 
AI is prohibited: [This course] assumes that all work submitted by students will be generated by the students themselves, working individually or in groups. Students should not have another person/entity do the writing of any substantive portion of an assignment for them, which includes hiring a person or a company to write assignments and using artificial intelligence tools like ChatGPT.  

AI is allowed with attribution: Use of AI tools, including ChatGPT, is permitted in this course for students who wish to use them. To adhere to our scholarly values, students must cite any AI-generated material that informed their work (this includes in-text citations and/or use of quotations, and in your reference list). Using an AI tool to generate content without proper attribution qualifies as academic dishonesty.  

AI is encouraged with certain tasks and with attribution: You can choose to use AI tools to help brainstorm assignments or projects or to revise existing work you have written. When you submit your assignment, I expect you to clearly attribute what text was generated by the AI tool (e.g., AI-generated text appears in a different colored font, quoted directly in the text, or use an in-text parenthetical citation). 

Communicate your perspective about AI use. In addition to syllabus statements, consider talking with your students about AI tools like ChatGPT.  
Different levels of familiarity: As an emerging technology, students will have differing levels of familiarity with these tools. For instance, while ChatGPT can write a grammatically correct paper or appear to solve a math problem, it may be unreliable and limited in scope. Discuss with students the uses and limitations of AI tools more broadly in addition to your perspective on their use in your class. 

Connect to critical thinking skills: AI tools have many implications beyond the classroom. Consider talking with students about how to be engaged consumers of AI content (e.g., how to identify trusted sources, reading critically, privacy concerns).  

Adapt assessments. AI tools are emerging and it can be incredibly difficult to make any assessment completely free from AI interference. Beyond a syllabus statement, you may also consider adapting your assessments to help reduce the usefulness of AI products. However before revising any assignment, it’s helpful to reflect on what exactly you want students to get out of the experience and share your expectations with your students. Is it just the end product, or does the process of creating the product play a significant role? 
Create assessments that allow students to develop ideas over time. Depending on your class size, consider scaffolding assessments to be completed in small components (e.g., proposal, annotated bibliography, outline, first draft, revised drafts). 

Ask students to connect their writing to specific course materials or current events. Students can draw from the course textbook, additional readings on the LMS, and even class discussion boards or in-class discussions.  

Incorporate personal experiences and reflections. Provide students with opportunities to connect what they are learning to their own lives and experiences—stories unique to each individual. 

Incorporate Multimedia Assessments. Consider developing or adapting assessments to include multimedia submissions (e.g., audio or video components). VoiceThread is a UMass Amherst supported tool that allows students to leave audio, visual, and video content.  Also, consider UMass-supported social annotation tools like Perusall or Google Docs for students to use when responding to assigned readings or other materials.  

Use class time. Ask students to complete writing assignments during class time (e.g. complete reading reflections at the beginning of class, or use exit tickets). Asking students to organize their ideas by writing during class may also support student engagement in other class activities such as discussions and group work.  

For questions on your LMS, Google, and other educational technology contact IDEAS at instruct@umass.edu",,Center for Teaching & Learning
Vedant,67,University of Pittsburgh,Q235034,"28,391","19,200","9,191",R1,"40.444565,-79.953274",Pittsburgh,PA,School of Computing and Information,https://www.pitt.edu,,"AI Academic Integrity Policy Suggestions
University of Pittsburgh Writing Institute Workshop on AI and the
Teaching of Writing*
Background to the generative AI suggested policy (for teachers):
As you may be aware, generative AI tools such as ChatGPT have made it possible to automate some
aspects of the writing process, including: brainstorming; analysis of texts; developing arguments or
counterarguments; improving organization; adjusting style and grammar to fit stylistic conventions; and
even wholesale generation of essays. What ChatGPT and other large language models (LLMs) write often
contains falsehoods, made-up quotes, and predictable writing. But their output is also often polishedsounding writing. As generative AI platforms evolve, they will get better at accurate quoting, writing
more interesting prose, and higher level research activities.
Students in our composition courses are aware of ChatGPT and other free, accessible AI writing tools
and some are already using them in our courses. Pitt's Academic Integrity Code prohibits
unacknowledged use of the writing of others, which addresses issues of plagiarism and contract
cheating. We believe that the code already implicitly covers the potential use of generative AI, although
the policy may be updated soon to explicitly address AI use.
The Composition Program encourages instructors to exercise their own judgment about student use of
these technologies within their courses. Composition courses can employ generative AI productively
and, if you would like to integrate such technologies in your course, we encourage you to seek out ways
to do so while adhering to composition course goals. We suggest that you make your policies clear by
including one of the following policies on your syllabus and Canvas site. Instructors should also discuss
their policies with students, make clear which uses of AI are allowed and which are not, and why.
If you have questions about the use of AI in your course, we encourage you to reach out to our
Academic Integrity Dean and Teaching Professor of English, Jeff Aziz.
Suggested syllabus statement if you want to prohibit the use of generative AI in your course:
The use of generative AI writing tools (such as ChatGPT, GrammarlyGO, GPT-3, GPT-4, BERT, or
others) is prohibited in this class. Assignments for the course have been designed to help you
develop as a writer without the use of these technologies. You will generate ideas, read, revise,
and write on your own and/or in consultation with peers, me, or Writing Center tutors and you
will not use AI at any stage of your writing process. You are the author of your work for the
course and authorship means you take responsibility for your words and claims. Any use of AI
technologies in your work will be considered an academic integrity violation and addressed
accordingly: https://www.as.pitt.edu/faculty/policies-and-procedures/academic-integrity-code .
Please see me if you have any questions about this policy.
Suggested syllabus statement if you want to allow limited uses of generative AI in your course:
The use of generative AI writing tools (such as ChatGPT, GrammarlyGO, GPT-3, GPT-4, BERT, or
others) is allowed in this class within specific contexts and only if such use is properly
acknowledged. Assignments for the course have been designed to help you develop as a writer,
and some of them may call on you to practice writing with the help of such tools. As your
instructor, I will assume that any use of these tools will be only within the contexts the
assignment allows (for instance, you can use ChatGPT for brainstorming if the assignment asks
you to do so). You must acknowledge the use of AI in your assignment in an ""Acknowledgement
of AI Use"" statement that:
· Specifies which technology was used and on what date (ChatGPT, GPT-3, etc)
· Includes explicit descriptions of how the information was generated
· Identifies the prompts used
· Explains how the output was used in your work
Examples of such Acknowledgments of AI Use can be found on Monash University's website.
The use of AI outside of contexts where the instructor specifies its use, or failure to
acknowledge any use of AI technologies in your work will be considered an academic integrity
violation and addressed according to Pitt’s Academic Integrity policies:
https://www.as.pitt.edu/faculty/policies-and-procedures/academic-integrity-code . You are the
author of your work for the course and authorship means you take responsibility for your words
and claims, regardless of which tools you use. Please see me if you have any questions about
this policy",,
Vedant,67,Villanova University,Q1466001,"9,800 (spring 2023)","6,791","3,108",R3,"40.03771,-75.33755",Villanova,PA,,http://www1.villanova.edu/content/main.html,,"Guidance on AI Text Generators
New open-access AI technologies are emerging (such as ChatGPT) that are able to generate written text based on user prompts.  Several at Villanova have put this new software through its paces, and we believe that most of the time, it does not generate college-level text suitable for paper submission.

At this time, AI-generated responses to broad essay-style questions lack detail and analytical depth. However, the technology will generate a starting point that a student could potentially edit and expand upon to generate an essay that will meet college standards. Furthermore, it can generate short answers that could be suitable for blogs, discussion boards, and more. 

We have put together some recommendations that faculty may consider implementing in the coming semester and in the future as AI tools become readily available and more sophisticated. 

Grading and Discussing with Students
Department/Program Actions
Best Practices/Help for Beating AI
Class Activities/Assignments

July 2023 Updates
Dear Faculty Colleagues,

We would like to update you with some information around A.I. generators such as ChatGPT in preparation for the fall semester.  A.I.’s capacity to generate text, computer code, graphics, music, and more is continuing to improve, and its use is becoming more commonplace. Most of our students are aware of these tools and have used them. While some time savings and useful information can be generated by A.I., substituting A.I. use for human cerebration can be detrimental to student learning in many situations, while in others it can be extremely helpful. It will continue to be up to the individual faculty member to allow or prohibit its use in their courses. We ask that you:

Become familiar with A.I. generators through readings and personal use.  Review our previous advice (see above) and VITAL’s newsletter on how to generate assignments in the age of A.I. Continue to have discussions in faculty meetings about this issue.  As this technology is here to stay and is steadily evolving, we need to continue to familiarize ourselves with its benefits and drawbacks and consider it within our disciplinary instructional contexts.  
Design instructional activities and assignments to directly support your courses’ learning goals. Should you find that A.I. use supports and/or enhances the students’ achievement of these goals, then consider its educational use. If not, you may consider prohibiting its use for that activity, assignment, or the entire course. Some forms of higher-order thinking, such as analytical reading, critical thinking, problem solving, evaluation, metacognition, and synthesis of knowledge, might not be mastered with the use of A.I.
Discuss with your classes the proper use (or prohibition) of A.I. and explain the reasoning behind your instructional decisions given the courses’ learning goals. Focus on the skills and cognitive capabilities your course intends to foster in your students and how A.I. can either support or inhibit building students’ competencies. Students must be able to utilize modern tools, develop abilities that exceed those of machines, evaluate the reliability of all information including that is generated by A.I., and meet the higher-order demands of engaged citizenship in an evever-changingcomplex world.
Set clear expectations and guidelines around appropriate A.I. use in your courses, and consider including one of the following statements for your syllabus/assignment that we have developed; you may adjust to reflect the nature of your course:
The use of A.I.-generated content is not permitted in this course/on this assignment. Its use will result in an academic integrity violation and a zero on the assignment.  
The use of A.I.-generated content is allowed in this course/on this assignment. Even if you have significantly edited A.I.-generated material, you must identify the A.I. tool used to assist in generating your work. You are required to provide the name of the tool, date used, and prompts used to generate the output. As you may be required to submit the original A.I. output you must keep a copy of the original output and provide it when requested.  If questions arise about the authorship of submitted work, you are responsible for authenticating your authorship. You should save evidence of your authorial process, such as drafts, notes, version histories, and complete transcripts of A.I. assistance.
The use of A.I.-generated content is permitted as follows (a) for generating a first draft or (b) for generating an outline or (c) for generating XXX.  Even if you have significantly edited A.I.-generated material, you must identify the A.I. tool used to assist in generating your work. You are required to provide the name of the tool, date used, and prompts used to generate the output. As you may be required to submit the original A.I. output, you must keep a copy of the original output and provide it when requested.  If questions arise about the authorship of submitted work, you are responsible for authenticating your authorship. You should save evidence of your authorial process, such as drafts, notes, version histories, and complete transcripts of A.I. assistance.
Understand it is challenging to detect A.I.-generated material.  A.I. detectors are not fully reliable, and there are apps available whose specific intent is to render A.I.-generated content undetectable.  
When filing an academic integrity violation for a student’s work, point to specific parts of the Code of Academic Integrity and, when possible, focus on aspects of the student’s work that are indisputably problematic. The Academic Policy Committee is in the process of updating the Code to address A.I. more explicitly with an expected announcement early in the fall semester. Some relevant sections of the Code (which you may decide to include in your syllabus) are:
""When completing an individual class assessment (i.e. assignment, quiz, lab report, exam, etc.) students shall rely on their own mastery of the subject and not attempt to receive help in any way not explicitly approved by the instructor.”
“Plagiarism is defined as the appropriation of another's work and the unacknowledged submission or incorporation of that work as one's own offered for credit.”  This statement applies to A.I.-generated material even if edited.
“Students shall not falsify, invent, or use in a deliberately misleading way any information, data, or citations in any assignment.”  Often A.I. will generate false citations or actual citations that do not correspond with the material.
Consider providing the attached “Guidelines for Students Regarding Responsible Academic Use of A.I.-Generated Material” to the students in your course and/or discuss topics contained within it.
 ",,
Vedant,73,Binghamton University (SUNY),Q863813,"18,148 (Spring 2022)","14,333 (2022)","3,815 (2022)",R1,"42.08925,-75.96989",Binghamton,NY,,https://www.binghamton.edu/,,"Suggested Syllabus Language for Generative AI
August 2023
Special thanks to the University of Toronto for allowing us to use much of their content.
We recognize that some instructors may want to allow, or even encourage, their students to use
generative AI technologies, and others may want to prohibit their use. The following suggested
statements are intended to help you shape the message you provide to your students on a course
syllabus and/or on assignment instructions to reinforce a shared understanding of what is, and is not,
allowed. This is an important conversation to have with your students so that everyone is clear about
their use in your class. If you are allowing or disallowing AI tools in your course, clarify for the students
why you made this decision and how AI assistance supports or, alternatively, negatively impacts the
pedagogical goals of the course or assignment.
Can use Generative AI tools
In indicating on a syllabus and/or assignment instructions that students may use generative AI, the
instructor should decide to what degree and on which assignments the students may use these tools.
This is similar to indicating to students when they may collaborate, and to what degree, with their
classmates, and when an assignment should be solely their own work.
Here are some suggested example statements that might be used, combined, or adapted for your course
or assignments:
• Students are encouraged to make use of technology, including generative AI tools, to contribute
to their understanding of course materials.
• Students may use artificial intelligence tools, including generative AI, in this course as learning
aids or to help produce assignments. However, students are ultimately accountable for the work
they submit.
• Students must submit, as an appendix with their assignments, any content produced by an
artificial intelligence tool, and the prompt used to generate the content.
• Any content produced by an artificial intelligence tool must be cited appropriately. Many
organizations that publish standard citation formats now provide information on citing
generative AI (e.g., MLA: https://style.mla.org/citing-generative-ai/ ).
• Students may choose to use generative AI tools as they work through the assignments in this
course; this use must be documented in an appendix for each assignment. The documentation
should include what tool(s) were used, how they were used, and how the results from the AI
were incorporated into the submitted work.
Note: Some generative AI applications may require a subscription fee. Please consider offering students
a choice to opt-out of using a system if they have concerns about the cost, privacy, security or other
issues related to the technology.
If you are indicating that students can using generative AI tools, it is important to include in your syllabus
statement two reminders to students about these tools:
? AI can lead to incorrect information and non-existent sources, so it is important that you verify
any information you use from an AI tool is correct and cite it.
? Do not input any personal information into AI tools.
Can use Generative AI in certain instances or specific ways
It is important to be very specific about the boundaries and limitations of artificial intelligence use in
completing course work, if there are boundaries you want to set. Please consider the difficulty for
students, who are trying to navigate AI rules in multiple courses before setting up elaborate limitations in
your course. However, there are reasons why you may want, or need, students to engage with generative
AI tools in a specific way or on a specific assignment.
Here are some suggested example statements that might be used, combined, or adapted for your course
or assignments:
• Students may use artificial intelligence tools for creating an outline for an assignment, but the
final submitted assignment must be original work produced by the individual student alone.
• Students may not use artificial intelligence tools for taking tests, writing research papers,
creating computer code, or completing major course assignments. However, these tools may be
useful when gathering information from across sources and assimilating it for understanding.
• Students may not use artificial intelligence tools for taking tests in this course, but students may
use generative AI tools for other assignments.
• Students may use the following, and only these, generative artificial intelligence tools in
completing their assignments for this course: …. No other generative AI technologies are
allowed to be used for assessments in this course. If you have any question about the use of AI
applications for course work, please speak with the instructor.
If you are indicating that students can using generative AI tools, it is important to include in your syllabus
statement two reminders to students about these tools:
? AI can lead to incorrect information and non-existent sources, so it is important that you verify
any information you use from an AI tool is correct and cite it.
? Do not input any personal information into AI tools.
Cannot use Generative AI
In indicating on a syllabus that students may not use generative artificial intelligence, the instructor
should decide to what degree and on which assignments the students may not use these tools. This is
similar to indicating to students when they may, or may not, collaborate with classmates and to what
degree. Note that as AI tools become incorporated into commonly used systems (e.g., Google docs), it
will become increasingly important to be clear about what functionalities are allowed or disallowed in
your course.
Here are some suggested example statements that might be used, combined, or adapted for your course
or assignments:
• The use of generative AI tools or apps for assignments in this course, including tools like ChatGPT
and other AI writing or coding assistants, is prohibited.
• The knowing use of generative AI tools, including ChatGPT and other AI writing and coding
assistants, for the completion of, or to support the completion of, an examination, term test,
assignment, or any other form of academic assessment, may be considered an academic offense
in this course.
• Representing as one’s own an idea, or expression of an idea, that was AI-generated may be
considered an academic offense in this course.
• Students may not copy or paraphrase from any generative artificial intelligence applications,
including ChatGPT and other AI writing and coding assistants, for the purpose of completing
assignments in this course.
• The use of generative artificial intelligence tools and apps is strictly prohibited in all course
assignments unless explicitly stated otherwise by the instructor in this course. This includes
ChatGPT and other AI writing and coding assistants. Use of generative AI in this course may be
considered use of an unauthorized aid, which is a form of cheating.
• This course policy is designed to promote your learning and intellectual development and to help
you reach course learning outcomes.",,
