Kiley,35,University of Illinois Urbana-Champaign,Q457281,"53,271 (Spring 2023)","33,186 (Spring 2023)","20,085 (Spring 2023)",R1,"40.110538888889,-88.228411111111",Champaign,IL,School of Information Sciences,https://illinois.edu/,https://www.vpaa.uillinois.edu/digital_risk_management/generative_ai/students/ ; https://www.vpaa.uillinois.edu/digital_risk_management/generative_ai/instructors/,"Generative AI Guidance for Students
Explore Generative AI
By exploring generative AI, students can discover innovative tools and approaches that can spark creativity, bolster critical thinking, enhance problem solving skills, and prepare for future careers. They should:

Keep current on emerging technologies.
Expect to encounter the unknown and to learn iteratively.
Experiment with various generative AI tools to understand affordances and limitations.
Investigate opportunities for enhancing student learning, personalization, and workload reduction to allow for higher level skills and learning activities.
Provide opportunities to explore and learn from each other.
Consider Diversity and Privacy
To ensure an equitable and safe application of this new technology, students should recognize the limitations associated with newly developing technologies.

Understand training data used to create generative AI models may be inherently biased. Students should be aware of this and think critically about results. As we move forward, we should encourage the use of diverse and unbiased data sets used in training models.
Be cautious of entering personal information. Discuss privacy implications.
Protect data and do not enter proprietary information.
Use Generative AI Responsibly
Writing and research are central ways of learning and understanding material in college. The central tenet of academic integrity is doing your own work. As such, tools that you use in the process of learning, writing, and research should be carefully considered.

Talk with your instructors about what is considered responsible use of generative AI in your discipline and in their course.

If you use a generative AI tool in your work, you should cite it. The APA and MLA both provide guidelines for citing generative AI work. Be sure to note how you used it: “I used it this much, in this way, and this percentage of work was generated by AI.” Open AI, the creators of ChatGPT, have a content co-author policy. The key here is to be ethical and not to deceive or mislead your readers.

In working with a generative AI tool, be certain to verify that the citations it generates actually exist. Many people have found that these generative tools invent articles to cite.

Remember to:

Follow only the specific permitted uses set by your instructor.
Document and attribute all generative AI contributions to your coursework.
Take full responsibility for generative AI contributions, ensuring the accuracy of facts and sources.
Think Critically About Generative AI
The output of generative AI models is not always accurate. It may be misleading, inaccurate, biased, and may even be made up. Use critical thinking skills and question the source and quality of training data used in the generative AI model. Carefully evaluate the results (and citations), fact check, determine accuracy/usefulness of output, and engage in class discussions to identify and address biases or inaccuracies.

Guide to Critical Thinking (Checklist, UIUC)

Developing a Critical Thinking Mindset (Course, 58min, LinkedIn Learning)

Critical Media Literacy and Civic Learning: AI Writing Tools, Politics, and History (Edtech Books)

A Beginner's Guide to Critical Thinking (Blog Post, Medium)

Ways to Use Generative AI
There are good and valid ways to leverage the power of generative AI. Here are a few ways:

Use it as part of the revision process to enhance your own work.
Shorten your own text.
Revise your own text for spelling and grammar.
Create study aids (e.g., flashcards) for quizzes or exams.
Test and practice your knowledge of course topics.
Conduct basic research on course and assignment topics.
Use it to help come up with new ideas or expand upon existing ones.
Develop skills related to usage of generative AI as it will add value to your profile for the workplace.
Generative AI can help people communicate, translate, summarize, and more.
Ways Not to Use Generative AI
There are some things to keep in mind when using generative AI for your coursework. Here are a few:

Don’t rely solely on information provided by generative AI as it may be inaccurate, misleading, biased, and even made-up. So can citations provided by generative AI.
Be transparent in your use of generative AI and cite as appropriate.
Don’t use generative AI to replace your critical thinking and problem-solving skills.
Use generative AI to supplement your learning, not to replace it. Generative AI Guidance for Instructors
LEARN
Explore Generative AI
By exploring generative AI, instructors can discover innovative tools and approaches that can improve student engagement, promote personalized learning, and provide valuable insight, ultimately enhancing the educational experience for students. They should:

Keep current on emergent technologies.
Expect to encounter the unknown and to learn iteratively.
Experiment with various generative AI tools to understand affordances and limitations.
Investigate opportunities for enhancing student learning, personalization, and workload reduction to allow for higher level skills and learning activities.
Provide opportunities to explore and learn from each other.
Support Inclusivity, Diversity, and Privacy
To ensure an equitable and safe learning environment, instructors should recognize the limitations associated with newly developing technologies.

Provide equal access to generative AI tools and resources for all students. Beyond the AI models, instructors should promote inclusivity and diversity in the classroom and support all students.
Understand that training data used to create generative AI models may be inherently biased. Instructors should be aware of this and think critically about results. As we move forward, we should encourage the use of diverse and unbiased data sets used in training models.
Be cautious of entering personal information. Discuss privacy implications.
Protect data and do not enter proprietary information.
REFOCUS
Recognize Limitations of AI Detection Tools
Don’t depend on AI detection tools to address the use of generative AI in your assignments. They are unreliable and easy to circumvent with small amounts of editing. They also generate many false positives. If you do use an AI detection tool on student writing, we suggest using at least two AI detection tools and comparing the results. Consider using these results as a conversation starter with students. Falsely accusing students of cheating with generative AI can quickly damage a learning community.

ASU & UCLA have both opted out of TII’s AI detection for now. Others like the University of Kansas caution faculty. The UM System has summarized their concerns and includes videos from TurnItIn on how the detection works. Here’s a Washington Post article on the efficacy of TurnItIn’s detection and how the company views the feature as a means to prompt a conversation with students instead of an accusation.

Adapt Assignments and Assessments
A careful review of your course from the lens of the impact of generative AI will help you know where to focus your attention. Identify assignments at risk for cheating with generative AI tools. Basic essays on fact-based topics and essays in which only the final draft is submitted are at high risk for cheating. Some strategies to revise at-risk assignment prompts include:

Focus on formative assessment and the process of writing (and thinking). Break down an assignment into smaller parts that help students form their ideas on a topic and receive feedback from peers and instructors. Compile these smaller assignments for the final project/essay.
Ask students to analyze, evaluate, or synthesize information obtained from generative AI and ask them how it could be improved, adapted, or enhanced. Students can drill deeper into the subject by refining or asking more specific questions.
Require that students incorporate personal reflections, local or course-based data, or require known specific sources.
Develop authentic assessments: (inquiry-based learning, problem-based learning, scenario-based learning, project-based learning, design-based learning).
Ask students to report on independent research activities.
Require students to adopt a particular moral or ethical stance.
Utilize progressive/reflective portfolio-style assignments that are iterative and episodic.
Create interactive synchronous oral or asynchronous video-based assessments.
Require students to ""show their work"" by submitting drafts or notes or using digital versioning.
Use an honor statement where students certify that work is their own, all sources are correctly attributed, and/or the contribution of any generative AI technologies is fully acknowledged.
TEACH
Establish Framework for the use of Generative AI in your Course
It is important to discuss academic integrity and the use of AI tools with students. The core principle of academic integrity is doing your own work. As such, when students cheat on assignments, they are cheating themselves of the opportunity to learn. The method of cheating — plagiarism, paying for an essay, generative AI tools, and others — doesn’t change the breach of academic integrity.

You can collaborate with your students to create a framework and generate parameters around the use of generative AI in the course. Cover the affordances and limitations of generative AI. Students may not have fully considered the implications of using generative AI. Discuss writing as a process for forming an understanding of topics in your discipline and course.

Be transparent about your learning outcomes and the teaching methods that inform your assignments. What are you hoping students learn through the work? When is using an AI tool required? When is it appropriate and acceptable? When is it out of bounds? How will use of generative AI be cited in classwork?

You may also want to update your academic integrity statement and syllabus to reflect generative AI tools.

Ways to Use Generative AI
There are good and valid ways to leverage the power of generative AI. Here are a few key points to consider:

Generative AI should be introduced in the course emphasizing its strengths and weaknesses.
To prepare students for future workplace exposure and expectations, they should be introduced to and supported in appropriate use of generative AI in their course(s).
Emphasize developing student understanding that generative AI is a tool to enhance problem solving and critical thinking.
Create assignments where students do their own work and then match it with a response from generative AI. Comparison of the two products can further enhance the learning process as students see how and what the generative AI is providing.
Educate students on the need to check the validity and reliability of the citations from generative AI as those citations might not exist or are not reliable.
Ask students to review and acknowledge the Academic Integrity policy of the university.
Ways Not to Use Generative AI
While it may be tempting to ignore the latest developments in artificial intelligence, it is important to recognize that the world as we have known it has changed. We cannot ignore its capabilities and potential. Generative AI is not a replacement for human input, feedback, and guidance. Rather, these advances give us the opportunity to expand our human capabilities and we should embrace it in an informed and hopeful way.",I put both the guidelines for students and the guidelines for instructors in the same cell even though they were on different webpages. Omitted the lists of resources.,
Kiley,35,"University of Wisconsin, Madison",Q838330,"49,886 (fall 2022)","37,235 (fall 2022)","12,651 (fall 2022)",R1,"43.07527778,-89.40972222",Madison,WI,School of Library and Information Studies,https://www.wisc.edu/,https://it.wisc.edu/statement-on-use-of-generative-ai/,"Statement on use of generative AI
Use of ChatGPT, Google Bard and other generative artificial intelligence (AI) tools and services is growing rapidly within higher education, including at UW?–?Madison. Although AI offers new and powerful capabilities for research and education,  it is clear it also poses a potential risk to institutional data that UW?–?Madison is legally and ethically obligated to protect.

University faculty, staff, students and affiliates must not enter institutional data into any generative AI tool or service unless that data is classified as public (low risk). Providing any data to generative AI tools or services as part of a query is equivalent to posting the data on a public-facing website. That is because generative AI “learns” by collecting and storing user-provided data. This data may then be used as output provided to others.

Use of generative AI by UW?–?Madison faculty, staff, students and affiliates is subject to UW?–?Madison, UW System Administration (UWSA) and Universities of Wisconsin Regent policies. Examples of generative AI use prohibited by these policies include, but are not limited to, the following:

Entering any sensitive, restricted or otherwise protected data – including hard-coded passwords – into any generative AI tool or service (see UW-523 Institutional Data and SYS 1031 Data Classification and Protection);
Using AI-generated code for institutional IT systems or services without review by a human to verify the absence of malicious elements (see UW-503 Cybersecurity Risk Management);
Using generative AI to violate laws; institutional policies, rules or guidelines; or agreements or contracts (see Regent Policy 25-3 Acceptable Use of Information Technology Resources).
In addition to violating UW policies, some of the above uses may also violate generative AI providers’ policies and terms.

Researchers who may need to enter higher risk data into a generative AI tool or service as part of their research programs should consult the policies referenced above. For additional guidance, researchers may contact Chief Technology Officer (CTO) Todd Shechter (todd.shechter@wisc.edu).

For uses of generative AI that are not prohibited, UW–Madison faculty, staff, students and affiliates can help protect themselves and others by choosing tools and services that exhibit the National Institute of Standards and Technology’s (NIST’s) characteristics of trustworthy AI.

You can learn more about the benefits and risks of using ChatGPT and other generative AI tools by attending the summer 2023 “Exploring Artificial Intelligence @ UW–Madison” webinar series. Sponsored by the Division of Information Technology (DoIT) and the Data Science Institute, the series aims to provide a platform for experts and visionaries in the field of AI. Speakers will share their insights, research and experiences in the classroom, research lab and wider academic community.

Also instructive is the “Generative AI @ UW–?Madison: Use & Policies” page.

If you have questions about classifying data, contact the relevant data steward.",This page https://it.wisc.edu/generative-ai-uw-madison-use-policies/ has a collection of policies specific to different topics regarding AI usage ; this would be tough to scrape because it's in a table format and the policies are all hyperlinked,
